{
  "schema_version": "v2-shadow-schedule-receipt/v1",
  "status": "v2_interrupted",
  "vertical": "smartphones",
  "row_limit": 100,
  "after_raw_id": 1400,
  "latest_raw_id": 1600,
  "due": true,
  "country_code": null,
  "initial_after_raw_id": null,
  "raw_id_upper_bound": null,
  "execution_id": null,
  "evaluation_id": null,
  "active_execution_id": null,
  "active_heartbeat_at": null,
  "heartbeat_age_seconds": null,
  "stale_recovery_eligible": false,
  "recovery_source_execution_id": null,
  "raw_payload_retained": false
}
